name,link,risk
Tata Large Cap Direct Plan Growth,https://groww.in/mutual-funds/tata-large-cap-fund-direct-growth,Very High Risk
Indiabulls Bluechip Direct Fund Growth,https://groww.in/mutual-funds/indiabulls-blue-chip-fund-direct-growth,Very High Risk
Mahindra Manulife ELSS Fund Direct Growth,https://groww.in/mutual-funds/mahindra-kar-bachat-yojana-direct-growth,Very High Risk
HSBC Multi Cap Fund Direct Growth,https://groww.in/mutual-funds/hsbc-multi-cap-fund-direct-growth,Very High Risk
SBI Healthcare Opportunities Fund Direct Plan Growth,https://groww.in/mutual-funds/sbi-pharma-fund-direct-growth,Very High Risk
WhiteOak Capital Mid Cap Fund Direct Growth,https://groww.in/mutual-funds/whiteoak-capital-mid-cap-fund-direct-growth,Very High Risk
Edelweiss Large & Mid Cap Direct Plan Growth,https://groww.in/mutual-funds/edelweiss-equity-opportunities-fund-direct-growth,Very High Risk
Aditya Birla Sun Life India GenNext Direct Fund Growth,https://groww.in/mutual-funds/birla-sun-life-india-gennext-fund-direct-growth,Very High Risk
HSBC ELSS Fund Direct Growth,https://groww.in/mutual-funds/hsbc-elss-fund-direct-growth,Very High Risk
Kotak India EQ Contra Fund Direct Growth,https://groww.in/mutual-funds/kotak-classic-equity-direct-growth,Very High Risk
UTI Dividend Yield Fund Direct Growth,https://groww.in/mutual-funds/uti-dividend-yield-fund-direct-growth,Very High Risk
